number|name|description|creditpoints|teachername|address|requirement|semester|faculty|degree
INF2205|Einführung IT-Security: Kryptografie, Software und|Dieses Modul führt theoretische und praktische Grundlagen der IT-Security ein, die insbesondere zu der Umsetzung der Schutzziele Vertraulichkeit, Integrität und Authentizität von Daten, Software und Systemen verwendet werden.|6|Prof. Dr. Andre Rein|https://www.thm.de/organizer/?option=com_organizer&view=SubjectItem&id=2347|Keine|4|FB06-MNI|Bioinformatik(B.Sc.2022)
INF2517|Funktionale Programmierung|Das Modul vermittelt die theoretischen Konzepte funktionaler Programmierung. Die Studierenden lernen diese auf praxisnahe Softwareprojekte anzuwenden.|6|Prof. Dr. Uwe Christoph Meyer|https://www.thm.de/organizer/?option=com_organizer&view=SubjectItem&id=2392|Bioinformatik (B.Sc. 2022)Programmieren 2 (INF1004)Theoretische Informatik 2 (INF1008), Programmieren 2 (INF1004), Theoretische Informatik 2 (INF1008), Informatik (B.Sc. 2022)Programmieren 2 (INF1004)Theoretische Informatik 2 (INF1008), Programmieren 2 (INF1004), Theoretische Informatik 2 (INF1008), Ingenieur-Informatik (B.Sc. 2022)Programmieren 2 (INF1004)Theoretische Informatik 2 (INF1008), Programmieren 2 (INF1004), Theoretische Informatik 2 (INF1008)|4|FB06-MNI|Bioinformatik(B.Sc.2022)
BI2502|Genetische Algorithmen|Kennenlernen der Stärken und besonderen Anwendungsbereiche genetischer Algorithmen.|6|Prof. Dr. Andreas Peter Dominik|https://www.thm.de/organizer/?option=com_organizer&view=SubjectItem&id=2351|Bioinformatik (B.Sc. 2022)Theoretische Informatik 2 (INF1008), Theoretische Informatik 2 (INF1008), Informatik (B.Sc. 2022)Theoretische Informatik 2 (INF1008), Theoretische Informatik 2 (INF1008)|4|FB06-MNI|Bioinformatik(B.Sc.2022)
INF2511|Grundlagen der Computergrafik|Die Studierenden erlernen die Grundlagen der Erstellung von 3D Modellen und erarbeiten die mathematischen Hintergründe von Transformationen im Raum. Gemeinsam steigen wir in die Programmiersprache C und die Grafikbibliothek OpenGL ein. Das Erlernte mündet in die Implementierung einer Grafikengine.|6|Prof. Dr. Uwe Christoph Meyer|https://www.thm.de/organizer/?option=com_organizer&view=SubjectItem&id=2386|Keine|4|FB06-MNI|Bioinformatik(B.Sc.2022)
INF2207|Grundlagen der Data Science|Die Vorlesung gibt einen Überblick über wichtige Anwendungen (Chatbots, Games, Data-Mining, Bilderkennung, Zeitreihenanalyse, etc.) sowie die Methoden des Data Science.|6|Dr. habil. Frank Kammer|https://www.thm.de/organizer/?option=com_organizer&view=SubjectItem&id=2349|Bioinformatik (B.Sc. 2022)Statistik und Datenanalyse (MAT2201)Theoretische Informatik 2 (INF1008), Statistik und Datenanalyse (MAT2201), Theoretische Informatik 2 (INF1008), Informatik (B.Sc. 2022)Statistik und Datenanalyse (MAT2201)Theoretische Informatik 2 (INF1008), Statistik und Datenanalyse (MAT2201), Theoretische Informatik 2 (INF1008), Social Media Systems (B.Sc. 2022)Statistik und Datenanalyse (MAT2201)Theoretische Informatik 2 (INF1008), Statistik und Datenanalyse (MAT2201), Theoretische Informatik 2 (INF1008), Ingenieur-Informatik (B.Sc. 2022)Statistik und Datenanalyse (MAT2201)Theoretische Informatik 2 (INF1008), Statistik und Datenanalyse (MAT2201), Theoretische Informatik 2 (INF1008)|4|FB06-MNI|Bioinformatik(B.Sc.2022)
GS2518|Grundlagen der Systemtheorie|Die Veranstaltung vermittelt die Grundlagen der Systemtheorie mit Schwerpunkt auf Informationstechnologie, Naturwissenschaften und Kommunikation in sozialen Medien.|6|Prof. Dr. Axel Schumann|https://www.thm.de/organizer/?option=com_organizer&view=SubjectItem&id=2355|Keine|4|FB06-MNI|Bioinformatik(B.Sc.2022)
INF2206|Interaktive Systeme|Der Kurs vermittelt die Grundlagen von Mensch-Computer Interaktion für das Entwickeln von interaktiven Systemen. Er beinhaltet Modelle der menschlichen Informationsverarbeitung, Grundregeln der UI Gestaltung, benutzerorientierte Gestaltungsprozesse und die Evaluation von interaktiven Systemen.|6|Prof. Dr. Martin Weigel|https://www.thm.de/organizer/?option=com_organizer&view=SubjectItem&id=2348|Keine|4|FB06-MNI|Bioinformatik(B.Sc.2022)
INF2528|Machine Learning|Das Modul vermittelt die Grundlagen des Maschinellen Lernens. Dazu zählt ein Überblick über die mathematischen und algorithmischen Grundlagen des Fachs sowie deren Umsetzung in Python unter Verwendung gängiger Frameworks, wie Numpy, Scipy, Scikit-Learn, Keras oder Tensorflow.|6|Prof. Dr. Franz Cemic|https://www.thm.de/organizer/?option=com_organizer&view=SubjectItem&id=2403|Keine|4|FB06-MNI|Bioinformatik(B.Sc.2022)
MAT1001|Mathematik 1|Erwerb der grundlegenden Kompetenzen des logischen Argumentierens und mathematischer Arbeitsweisen anhand von Inhalten der Diskreten Mathematik|6|Prof. Dr. Bettina Just|https://www.thm.de/organizer/?option=com_organizer&view=SubjectItem&id=2340|Keine|4|FB06-MNI|Bioinformatik(B.Sc.2022)
MAT1002|Mathematik 2|Vertiefung der grundlegenden Kompetenzen des logischen Argumentierens und mathematischer Arbeitsweisen anhand von Inhalten der Linearen Algebra und der Differentialrechnung von Funktionen einer Variablen.|6|Prof. Dr. Frank Recker|https://www.thm.de/organizer/?option=com_organizer&view=SubjectItem&id=2341|Bioinformatik (B.Sc. 2022)Mathematik 1 (MAT1001), Mathematik 1 (MAT1001), Informatik (B.Sc. 2022)Mathematik 1 (MAT1001), Mathematik 1 (MAT1001), Social Media Systems (B.Sc. 2022)Mathematik 1 (MAT1001), Mathematik 1 (MAT1001), Ingenieur-Informatik (B.Sc. 2022)Mathematik 1 (MAT1001), Mathematik 1 (MAT1001)|4|FB06-MNI|Bioinformatik(B.Sc.2022)
GS2502|Methoden und Didaktik für Tutorinnen und Tutoren|Die Studierenden haben Grundlagen der Didaktik und Methodik erworben und im Rahmen einer Praxisphase als Tutor/in angewendet.|3|Prof. Silke Bock|https://www.thm.de/organizer/?option=com_organizer&view=SubjectItem&id=2353|Keine|4|FB06-MNI|Bioinformatik(B.Sc.2022)
NAT2003|Molekularbiologie|Grundlegende molekularbiologische Prozesse: Replikation der DNA, Transkription und Translation bei Pround Eukaryoten; Prozessierung eukaryotischer Gene; Genexpression und -regulation; Verfahren und Methoden der Gentechnologie, Ethik, Gentechnikgesetz; Umgang mit gentechnisch veränderten Mikroorganismen im Labor, Planung des Arbeitsablaufs mit Versuchen zu Klonierung, PCR, Nukleinsäureisolation und Analytik mittels Elektrophorese. Schriftliche Ausarbeitung und Interpretation der Ergebnisse.|6|Prof. Dr. Stephanie Gokorsch|https://www.thm.de/organizer/?option=com_organizer&view=SubjectItem&id=2466|Bioinformatik (B.Sc. 2022)Allgemeine Biologie (NAT1002)Chemie für Bioinformatik (NAT1001), Allgemeine Biologie (NAT1002), Chemie für Bioinformatik (NAT1001)|4|FB06-MNI|Bioinformatik(B.Sc.2022)
NAT2501|Molekularbiologie 2|Verschiedene klassische und moderne Methoden sowie grundlegende Analysemethoden und Verfahren der Molekularbiologie und Gentechnologie werden mit Bezug zur Anwendung im Wirkstofffindungs- und Entwicklungsprozess vermittelt. Ziel ist darüber hinaus, die erlernten Methoden in Bezug auf Targetidentifizierung und Targetvalidierung zuzuordnen, die Methoden zur Bearbeitung verschiedenen Probendurchsatzes zu erkennen und deren Limitationen zu erarbeiten.|3|Prof. Dr. Stephanie Gokorsch|https://www.thm.de/organizer/?option=com_organizer&view=SubjectItem&id=2476|Bioinformatik (B.Sc. 2022)Allgemeine Biologie (NAT1002)Molekularbiologie (NAT2003), Allgemeine Biologie (NAT1002), Molekularbiologie (NAT2003)|4|FB06-MNI|Bioinformatik(B.Sc.2022)
BI2503|Multivariate Statistik|Verfahren und Anwendungen der multivariaten Statistik auf Problemstellungen der Datenanalyse.|3|Prof. Dr. Franz Cemic|https://www.thm.de/organizer/?option=com_organizer&view=SubjectItem&id=2468|Bioinformatik (B.Sc. 2022)Statistik und Datenanalyse (MAT2201), Statistik und Datenanalyse (MAT2201)|4|FB06-MNI|Bioinformatik(B.Sc.2022)
BI2506|Next Generation Sequencing|Das Modul führt in die Sequenzierverfahren der zweiten und dritten Generation ein.|6|Prof. Dr. Franz Cemic|https://www.thm.de/organizer/?option=com_organizer&view=SubjectItem&id=2471|Bioinformatik (B.Sc. 2022)Bioinformatik 2 mit Projekt (BI1002)Computational Biology (BI2001), Bioinformatik 2 mit Projekt (BI1002), Computational Biology (BI2001)|4|FB06-MNI|Bioinformatik(B.Sc.2022)
INF2512|Open-Source-Programmierwerkzeuge|Versionsverwaltung und Fehlersuche sind alltägliche Bestandteile bei der Softwareentwicklung. Verschiedene Hilfsprogramme und ihre geschickte Kombination können manche Aufgabe deutlich erleichtern.|6|Prof. Dr. Uwe Christoph Meyer|https://www.thm.de/organizer/?option=com_organizer&view=SubjectItem&id=2387|Keine|4|FB06-MNI|Bioinformatik(B.Sc.2022)
GEN3001|Praxisphase|Die Studierenden wenden ihre im Studium erworbenen Kenntnisse und Fähigkeiten in einem praxisnahen Kontext an und stellen ihre Ergebnisse in einer Präsentation vor. Damit bereiten Sie sich fachlich wie methodische auf die Bachelorarbeit vor.|15|Prof. Dr. Alexander Dworschak|https://www.thm.de/organizer/?option=com_organizer&view=SubjectItem&id=2628|Keine|4|FB06-MNI|Bioinformatik(B.Sc.2022)
INF1003|Programmieren 1|Die Studierenden erlernen grundlegende Konzepte einer modernen Programmiersprache, die prozedurale und objektorientierte Sprachkonstrukte umfasst. Die Studierenden können kürzere Programme entwickeln, die die erlernten Sprachkonzepte umsetzen und kombinieren.|6|Prof. Dr. Dominikus Herzberg|https://www.thm.de/organizer/?option=com_organizer&view=SubjectItem&id=2334|Keine|4|FB06-MNI|Bioinformatik(B.Sc.2022)
INF1004|Programmieren 2|Die Studierenden beherrschen grundlegende Konzepte einer modernen Programmiersprache, die sowohl prozedurale, objektorientierte als auch funktionale Sprachkonstrukte umfasst. Sie sind dazu befähigt, ein umfangreicheres Programmiervorhaben im Rahmen des Integrationsprojekts umzusetzen.|6|Prof. Dr. Dominikus Herzberg|https://www.thm.de/organizer/?option=com_organizer&view=SubjectItem&id=2335|Bioinformatik (B.Sc. 2022)Programmieren 1 (INF1003), Programmieren 1 (INF1003), Informatik (B.Sc. 2022)Programmieren 1 (INF1003), Programmieren 1 (INF1003), Ingenieur-Informatik (B.Sc. 2022)Programmieren 1 (INF1003), Programmieren 1 (INF1003)|4|FB06-MNI|Bioinformatik(B.Sc.2022)
BI2505|Proteinkristallographie|Das Modul führt in die Grundlagen der Röntgenstrukturanalyse von Proteinen (Proteinkristallographie) ein. Nach einer kompakten Einführung (bzw. Wiederholung) in die physikalischen Grundlagen der Kristallographie werden die wesentlichen Arbeitsschritte zur Aufklärung einer Proteinstruktur behandelt.|3|Prof. Dr. Andreas Peter Dominik|https://www.thm.de/organizer/?option=com_organizer&view=SubjectItem&id=2470|Bioinformatik (B.Sc. 2022)Biochemie für Bioinformatik (NAT2002)Bioinformatik 2 mit Projekt (BI1002), Biochemie für Bioinformatik (NAT2002), Bioinformatik 2 mit Projekt (BI1002)|4|FB06-MNI|Bioinformatik(B.Sc.2022)
GS2201|Recht für Informatiker/innen|Die Studierenden haben ein Bewusstsein für Rechtsfragen und kennen mögliche rechtliche Implikationen ihres späteren Arbeitsumfeldes.|3|Prof. Dr. Alexander Dworschak|https://www.thm.de/organizer/?option=com_organizer&view=SubjectItem&id=2427|Keine|4|FB06-MNI|Bioinformatik(B.Sc.2022)
BI2004|Seminar Bioinformatics|Die Studierenden präsentieren ein spezielles Thema der Bioinformatik, in welches sie sich selbständig einarbeiten. Sprache für Unterlagen und Vortrag ist Englisch.|3|Prof. Dr. Andreas Peter Dominik|https://www.thm.de/organizer/?option=com_organizer&view=SubjectItem&id=2464|Bioinformatik (B.Sc. 2022)Bioinformatik 2 mit Projekt (BI1002), Bioinformatik 2 mit Projekt (BI1002)|4|FB06-MNI|Bioinformatik(B.Sc.2022)
INF2001|Software Engineering: Konzepte und Methoden|Einführung in die Softwaretechnik|6|Steffen Vaupel|https://www.thm.de/organizer/?option=com_organizer&view=SubjectItem&id=2436|Bioinformatik (B.Sc. 2022)Bioinformatik 2 mit Projekt (BI1002), Bioinformatik 2 mit Projekt (BI1002), Informatik (B.Sc. 2022)Informatik-Projekt (GEN2001), Informatik-Projekt (GEN2001), Social Media Systems (B.Sc. 2022)Webbasierte Programmierung 2 (INF1002), Webbasierte Programmierung 2 (INF1002), Ingenieur-Informatik (B.Sc. 2022)Informatik-Projekt (GEN2001), Informatik-Projekt (GEN2001)|4|FB06-MNI|Bioinformatik(B.Sc.2022)
INF2002|Software Engineering: Realisierung|Angeleitete Planung und Durchführung eines Softwareprojekts in einer Projektgruppe.|9|Steffen Vaupel|https://www.thm.de/organizer/?option=com_organizer&view=SubjectItem&id=2342|Bioinformatik (B.Sc. 2022)Software Engineering: Konzepte und Methoden (INF2001), Software Engineering: Konzepte und Methoden (INF2001), Informatik (B.Sc. 2022)Software Engineering: Konzepte und Methoden (INF2001), Software Engineering: Konzepte und Methoden (INF2001), Social Media Systems (B.Sc. 2022)Software Engineering: Konzepte und Methoden (INF2001), Software Engineering: Konzepte und Methoden (INF2001), Ingenieur-Informatik (B.Sc. 2022)Software Engineering: Konzepte und Methoden (INF2001), Software Engineering: Konzepte und Methoden (INF2001)|4|FB06-MNI|Bioinformatik(B.Sc.2022)
MAT2201|Statistik und Datenanalyse|Beschreibende und schließende Statistik unter Einbeziehung von Grundlagen der Wahrscheinlichkeitstheorie und unter Verwendung der Skriptsprache R|6|Prof. Dr. Matthias Gundlach|https://www.thm.de/organizer/?option=com_organizer&view=SubjectItem&id=2350|Keine|4|FB06-MNI|Bioinformatik(B.Sc.2022)
GS2501|Technisches Englisch|Practical language training to improve students' communication skills (level B1-B2); dealing with general and study-related topics.|3|Prof. Dr. Alexander Dworschak|https://www.thm.de/organizer/?option=com_organizer&view=SubjectItem&id=2352|Keine|4|FB06-MNI|Bioinformatik(B.Sc.2022)
INF1007|Theoretische Informatik 1|Formalwissenschaftliche Grundlagen der Informatik.|6|Prof. Dr. Andreas Gogol-Döring|https://www.thm.de/organizer/?option=com_organizer&view=SubjectItem&id=2338|Keine|4|FB06-MNI|Bioinformatik(B.Sc.2022)
INF1008|Theoretische Informatik 2|Formalwissenschaftliche Grundlagen der Informatik mit Fokus auf algorithmische Techniken und Problemlösungsstrategien.|6|Prof. Dr. Andreas Gogol-Döring|https://www.thm.de/organizer/?option=com_organizer&view=SubjectItem&id=2339|Bioinformatik (B.Sc. 2022)Theoretische Informatik 1 (INF1007), Theoretische Informatik 1 (INF1007), Informatik (B.Sc. 2022)Theoretische Informatik 1 (INF1007), Theoretische Informatik 1 (INF1007), Social Media Systems (B.Sc. 2022)Theoretische Informatik 1 (INF1007), Theoretische Informatik 1 (INF1007), Ingenieur-Informatik (B.Sc. 2022)Theoretische Informatik 1 (INF1007), Theoretische Informatik 1 (INF1007)|4|FB06-MNI|Bioinformatik(B.Sc.2022)
GEN2501|Tools quantitativer Forschung|Die Studierenden lernen die Grundlagen der quantitativen Forschung von der Erstellung eines Fragebogens über die computergestützte Verarbeitung der Daten bis zur Durchführung deskriptiver statistischer Analysen.|3|Prof. Dr. Julie Dolores Woletz|https://www.thm.de/organizer/?option=com_organizer&view=SubjectItem&id=2474|Keine|4|FB06-MNI|Bioinformatik(B.Sc.2022)
INF2519|Web Programming Weeks 1|Diese als Kompaktpraktikum durchgeführte Veranstaltung vermittelt sehr praktische Kenntnisse im Umgang webbasierte Techniken unter Verwendung wichtiger Frameworks mit dem Ziel, diese zur Entwicklung einfacher Systeme einzusetzen. Dabei sollen insbesondere auch agiler Prinzipien eingeübt werden.|6|Prof. Dr. Peter Kneisel|https://www.thm.de/organizer/?option=com_organizer&view=SubjectItem&id=2394|Keine|4|FB06-MNI|Bioinformatik(B.Sc.2022)
BI1017|Algorithmen auf Sequenzen|Grundlegende Methoden für das Suchen, Vergleichen, Alignieren und Assemblieren von Sequenzdaten.|6|Prof. Dr. Andreas Gogol-Döring|https://www.thm.de/organizer/?option=com_organizer&view=SubjectItem&id=637|Informatik (B.Sc. 2010)Algorithmen und Datenstrukturen (CS1017), Algorithmen und Datenstrukturen (CS1017)|4|FB06-MNI|Informatik(B.Sc.2010)
CS2345|Algorithmen für Computerspiele|Das Modul befasst sich mit theoretischen, algorithmischen, technischen Methoden, die für die Analyse, die Programmierung oder das Design von Computerspielen verwendet werden können.|6|Prof. Dr. Andreas Gogol-Döring|https://www.thm.de/organizer/?option=com_organizer&view=SubjectItem&id=790|Informatik (B.Sc. 2010)Algorithmen und Datenstrukturen (CS1017), Algorithmen und Datenstrukturen (CS1017)|4|FB06-MNI|Informatik(B.Sc.2010)
CS1017|Algorithmen und Datenstrukturen|Grundlegende Methoden bei Entwurf und Analyse von Algorithmen und Datenstrukturen.|6|Prof. Dr. Andreas Gogol-Döring|https://www.thm.de/organizer/?option=com_organizer&view=SubjectItem&id=6|Informatik (B.Sc. 2010)Grundlagen der Informatik (CS1014)Objektorientierte Programmierung (CS1013), Grundlagen der Informatik (CS1014), Objektorientierte Programmierung (CS1013)|2|FB06-MNI|Informatik(B.Sc.2010)
MN1011|Analysis und numerische Methoden|Differential- und Integralrechnung, komplexe Zahlen, Forurierreihen, numerische Methoden.|6|Prof. Dr. Irene Schmalen|https://www.thm.de/organizer/?option=com_organizer&view=SubjectItem&id=49|Keine|4|FB06-MNI|Informatik(B.Sc.2010)
CS2012|Android-Praktikum: Anwendungsentwicklung|In diesem Modul werden die Grundlagen der Plattform und das Anwendungsprogrammiermodell von Android vermittelt.|9|Sebastian Süß|https://www.thm.de/organizer/?option=com_organizer&view=SubjectItem&id=2444|Informatik (B.Sc. 2010)Objektorientierte Programmierung (CS1013), Objektorientierte Programmierung (CS1013)|4|FB06-MNI|Informatik(B.Sc.2010)
IT2001|Architekturen von Webservices|Diese Veranstaltung vermittelt vertiefte Grundlagen und Anwendungen zur serverseitigen Webprogrammierung.|6|Prof. Dr. Peter Kneisel|https://www.thm.de/organizer/?option=com_organizer&view=SubjectItem&id=1540|Informatik (B.Sc. 2010)Datenbanksysteme (CS1020)Webbasierte Systeme (CS1024), Datenbanksysteme (CS1020), Webbasierte Systeme (CS1024), Social Media Systems (B.Sc. 2016)Webbasierte Programmierung 2 (IT1002), Webbasierte Programmierung 2 (IT1002)|4|FB06-MNI|Informatik(B.Sc.2010)
CS2375|Augmented Reality|Dieses Modul bietet eine Einführung in die Entwicklung von Augmented Reality Anwendungen. Diese umfasst die Betrachtung der Realisierung unter Rücksichtnahme auf Benutzbarkeit und Nutzererfahrung, die technischen und mathematischen Grundlagen sowie die Auseinandersetzung mit ethischen und rechtlichen Aspekten.|6|Keine|https://www.thm.de/organizer/?option=com_organizer&view=SubjectItem&id=2448|Keine|4|FB06-MNI|Informatik(B.Sc.2010)
SK2036|Ausbildereignung|Keine|6|Keine|https://www.thm.de/organizer/?option=com_organizer&view=SubjectItem&id=2453|Keine|4|FB06-MNI|Informatik(B.Sc.2010)
SK2013|Auslandssemester+|Ziel dieses Moduls ist es, den Lernprozess eines studien- oder berufsbezogenen Auslandsaufenthalts zu reflektieren, fachlich aufzuarbeiten, darzustellen und anderen Studierenden mit aktuellen Kommunikationstechniken zugänglich zu machen. Dazu sollen die Studierenden ihren Auslandaufenthalt bewusst vorbereiten, begleitend dokumentieren, abschließend beurteilen und Hilfestellungen für zukünftige Auslandsstudierende erstellen.|6|Laura Magdeburg|https://www.thm.de/organizer/?option=com_organizer&view=SubjectItem&id=641|Keine|4|FB06-MNI|Informatik(B.Sc.2010)
CS2315|Automaten und formale Sprachen|Beschreibungen und Eigenschaften von regulären und kontextfreien Sprachen sowie von Turing-Maschinen.|6|Prof. Dr. Albert Schneider|https://www.thm.de/organizer/?option=com_organizer&view=SubjectItem&id=31|Informatik (B.Sc. 2010)Diskrete Mathematik (MN1007), Diskrete Mathematik (MN1007)|4|FB06-MNI|Informatik(B.Sc.2010)
CS2380|Automotive Software Engineering|Keine|6|Keine|https://www.thm.de/organizer/?option=com_organizer&view=SubjectItem&id=2093|Keine|4|FB06-MNI|Informatik(B.Sc.2010)
CS3006|Bachelorarbeit mit Kolloquium|Die Studierenden wenden die im Studium erworbene Fachkompetenz in einer praktischen Aufgabe an und zeigen damit ihre Fähigkeit der Übertragung der Kenntnisse der Informatik auf konkrete Fragestellungen.|15|Prof. Dr. Alexander Dworschak|https://www.thm.de/organizer/?option=com_organizer&view=SubjectItem&id=2456|Informatik (B.Sc. 2010)Projektphase (CS3004), Projektphase (CS3004)|4|FB06-MNI|Informatik(B.Sc.2010)
CS1022|Betriebssysteme|In der Veranstaltung werden Grundlagen der Architektur, der Funktionsweise und Programmierschnittstellen moderner Betriebssysteme behandelt. In exemplarischen Aufgaben wird das Gelernte praktisch vertieft.|6|Prof. Dr. Andre Rein|https://www.thm.de/organizer/?option=com_organizer&view=SubjectItem&id=10|Informatik (B.Sc. 2010)Konzepte systemnaher Programmierung (CS1018), Konzepte systemnaher Programmierung (CS1018)|4|FB06-MNI|Informatik(B.Sc.2010)
II2002|Bildverarbeitung und Einführung in die Mustererkennung|Kamera und Beleuchtungstechnik, Bildtransformationen, Bildverarbeitungsfilter, Segmentierung, morphologische Filter. Statistische Mustererkennung: Zusammenhangsanalyse, Merkmalsbestimmung.|6|Moritz Schauer|https://www.thm.de/organizer/?option=com_organizer&view=SubjectItem&id=43|Keine|4|FB06-MNI|Informatik(B.Sc.2010)
SK2022|Bits und Bäume: Digitalisierung nachhaltig gestalten|In der Veranstaltung geht es um die materiellen Auswirkungen und die gesellschaftlichen Einflüsse der Informatik auf Natur, Wirtschaft und unsere Demokratie.|6|Prof. Dr. Alexander Dworschak|https://www.thm.de/organizer/?option=com_organizer&view=SubjectItem&id=1285|Keine|4|FB06-MNI|Informatik(B.Sc.2010)
II2019|Business Analytics|In der Veranstaltung lernen die Studierenden den Business Analytics Prozess kennen und wie dieser genutzt wird, um betriebswirtschaftliche Problemstellungen zu lösen.|6|Prof. Dr. Christian Überall|https://www.thm.de/organizer/?option=com_organizer&view=SubjectItem&id=889|Keine|4|FB06-MNI|Informatik(B.Sc.2010)
IT2003|CMS und Webanwendungen|Die Studierenden lernen die Grundlagen der in der Praxis am häufigsten verwendeten Web Content Management Systeme kennen. Dazu gehört unter anderem Wissen über die Systemarchitektur, Konfiguration und Erweiterung von klassischen CMS wie zum Beispiel Wordpress. In Projektarbeiten verwenden sie ein auf Node.js basierendes Headless CMS zur Realisierung einer komplexen Webanwendung.|6|Prof. Dr. Peter Kneisel|https://www.thm.de/organizer/?option=com_organizer&view=SubjectItem&id=2077|Informatik (B.Sc. 2010)Webbasierte Systeme (CS1024), Webbasierte Systeme (CS1024), Social Media Systems (B.Sc. 2016)Webbasierte Programmierung 2 (IT1002), Webbasierte Programmierung 2 (IT1002)|4|FB06-MNI|Informatik(B.Sc.2010)
CS2304|Code Refactoring|Der Kurs vermittelt Kenntnisse und Erfahrungswissen über Refactoring-Methoden. In Übungen mit Refactoring-Werkzeugen lernen die Studierenden, ihre Code-Produktivität zu steigern und die Qualität ihres Quellcodes zu verbessern.|6|Prof. Dr. Klaus-Dieter Quibeldey-Cirkel|https://www.thm.de/organizer/?option=com_organizer&view=SubjectItem&id=28|Informatik (B.Sc. 2010)Softwaretechnik-Projekt (CS1023), Softwaretechnik-Projekt (CS1023)|4|FB06-MNI|Informatik(B.Sc.2010)
CS2339|Codequalität|Die Veranstaltung behandelt häufige Probleme bei der Entwicklung und Implementierung von Software und vermittelt Wege, zu gutem Code zu gelangen.|6|Prof. Dr. Uwe Christoph Meyer|https://www.thm.de/organizer/?option=com_organizer&view=SubjectItem&id=26|Keine|4|FB06-MNI|Informatik(B.Sc.2010)
CS1019|Compilerbau|Die Veranstaltung vermittelt wichtige Konzepte moderner Programmiersprachen und der Entwicklung von Compilern unter Verwendung von Compilergeneratoren.|6|Prof. Dr. Uwe Christoph Meyer|https://www.thm.de/organizer/?option=com_organizer&view=SubjectItem&id=8|Informatik (B.Sc. 2010)Algorithmen und Datenstrukturen (CS1017)Programmierung interaktiver Systeme (CS1016), Algorithmen und Datenstrukturen (CS1017), Programmierung interaktiver Systeme (CS1016)|3|FB06-MNI|Informatik(B.Sc.2010)
CS2368|Containerisierte Anwendungen|Für eine optimale Auslastung von Hardware-Ressourcen wird häufig Virtualisierung eingesetzt. Containerisierung bildet dabei eine besondere Form der Virtualisierung. Containerisierte Anwendungen lassen sich leicht veröffentlichen, skalieren und sind in hohem Maße unabhängig von der eingesetzten Hard- und Software.|6|Prof. Dr. Klaus-Dieter Quibeldey-Cirkel|https://www.thm.de/organizer/?option=com_organizer&view=SubjectItem&id=1525|Keine|4|FB06-MNI|Informatik(B.Sc.2010)
CS2327|Content Management Systeme: Konzepte und Realisierung|Die Studenten lernen die Kernkomponenten und Aufgaben eines CMS kennen. Sie sind in der Lage bestehende CMS zu bewerten und können eigene CMS planen.|6|Prof. Dr. Peter Kneisel|https://www.thm.de/organizer/?option=com_organizer&view=SubjectItem&id=33|Informatik (B.Sc. 2010)Webbasierte Systeme (CS1024), Webbasierte Systeme (CS1024), Social Media Systems (B.Sc. 2016)Webbasierte Programmierung 2 (IT1002), Webbasierte Programmierung 2 (IT1002)|4|FB06-MNI|Informatik(B.Sc.2010)
CS2022|Cross-Platform Development|In der Veranstaltung lernen die Studierenden aktuelle Techniken und Frameworks für eine plattformübergreifende Entwicklung kennen. Anschließend wird das erlernte Wissen in einem Projekt angewendet, bei dem die Studierenden eine App entwickeln, welche auf Windows OS, iOS, MacOS und Android ausgeführt werden kann.|9|Prof. Dr. Christian Überall|https://www.thm.de/organizer/?option=com_organizer&view=SubjectItem&id=2090|Informatik (B.Sc. 2010)Objektorientierte Programmierung (CS1013)Programmierung interaktiver Systeme (CS1016), Objektorientierte Programmierung (CS1013), Programmierung interaktiver Systeme (CS1016), Social Media Systems (B.Sc. 2016)Grundlagen und Anwendungen Social Media 2 (SM1002)Webbasierte Programmierung 2 (IT1002), Grundlagen und Anwendungen Social Media 2 (SM1002), Webbasierte Programmierung 2 (IT1002)|4|FB06-MNI|Informatik(B.Sc.2010)
CS2382|Cybersicherheit im Unternehmen|Keine|6|Keine|https://www.thm.de/organizer/?option=com_organizer&view=SubjectItem&id=2449|Keine|4|FB06-MNI|Informatik(B.Sc.2010)
