number|name|description|creditpoints|teachername|address|requirement|semester|faculty|degree
SM2502|Einführung in die Werbung|Die Veranstaltung vermittelt einen praktischen Einstieg in die Werbung und zielt darauf ab, Werbeformen zu analysieren, zu produzieren und hinsichtlich ihrer Wirkung zu überprüfen.|6|Prof. Dr. Julie Dolores Woletz|https://www.thm.de/organizer/?option=com_organizer&view=SubjectItem&id=795|Keine|4|FB06-MNI|Soc.MediaSys.(B.Sc.2016)
CS2363|Einführung ins Quantencomputing|Das Modul erläutert das Berechnungsmodell des Quantencomputing anhand einfacher Beispiele|6|Prof. Dr. Bettina Just|https://www.thm.de/organizer/?option=com_organizer&view=SubjectItem&id=1215|Keine|4|FB06-MNI|Soc.MediaSys.(B.Sc.2016)
CS2362|Einführung IT-Security: Kryptografie, Software und Systemsicherheit|Dieses Modul führt theoretische und praktische Grundlagen der IT-Security ein, die insbesondere zu der Umsetzung der Schutzziele Vertraulichkeit, Integrität und Authentizität von Daten, Software und Systemen verwendet werden.|6|Prof. Dr. Andre Rein|https://www.thm.de/organizer/?option=com_organizer&view=SubjectItem&id=1213|Keine|4|FB06-MNI|Soc.MediaSys.(B.Sc.2016)
SM2500|eLearning|Das Modul führt in die didaktischen und technischen Grundlagen webbasierter Lernumgebungen ein. Es vermittelt Fertigkeiten und Kompetenzen für die Gestaltung digitaler Selbstlernmedien und Online-Schulungen.|6|Prof. Dr. Klaus-Dieter Quibeldey-Cirkel|https://www.thm.de/organizer/?option=com_organizer&view=SubjectItem&id=760|Keine|4|FB06-MNI|Soc.MediaSys.(B.Sc.2016)
SK2033|English for STEM 1|Handlungsorientierte Verwendung der englischen Sprache in komplexen Zusammenhängen im Bereich MINT auf dem unteren B2 Niveau.|3|Dipl.-Sprachlehrerin Christine Maria Beckmann|https://www.thm.de/organizer/?option=com_organizer&view=SubjectItem&id=2096|Keine|4|FB06-MNI|Soc.MediaSys.(B.Sc.2016)
SK2034|English for STEM 2|Handlungsorientierte Verwendung der englischen Sprache in komplexen Zusammenhängen im Bereich MINT auf dem mittleren B2 Niveau.|3|Dipl.-Sprachlehrerin Christine Maria Beckmann|https://www.thm.de/organizer/?option=com_organizer&view=SubjectItem&id=2097|Keine|4|FB06-MNI|Soc.MediaSys.(B.Sc.2016)
SK2035|English for STEM 3|Handlungsorientierte Verwendung der englischen Sprache in komplexen Zusammenhängen im Bereich MINT auf dem oberen B2 Niveau.|3|Dipl.-Sprachlehrerin Christine Maria Beckmann|https://www.thm.de/organizer/?option=com_organizer&view=SubjectItem&id=2098|Keine|4|FB06-MNI|Soc.MediaSys.(B.Sc.2016)
CS2018|Entwicklung mobiler Applikationen|In diesem Modul werden die Grundlagen und die Entwicklung von mobilen webbasierten Hybrid-Apps vermittelt.|9|Sebastian Süß|https://www.thm.de/organizer/?option=com_organizer&view=SubjectItem&id=21|Informatik (B.Sc. 2010)Objektorientierte Programmierung (CS1013)Webbasierte Systeme (CS1024), Objektorientierte Programmierung (CS1013), Webbasierte Systeme (CS1024), Social Media Systems (B.Sc. 2016)Webbasierte Programmierung 2 (IT1002), Webbasierte Programmierung 2 (IT1002)|4|FB06-MNI|Soc.MediaSys.(B.Sc.2016)
CS2019|Entwicklung webbasierter Client-Server-Systeme|Die Veranstaltung vermittelt Kenntnisse und Kompetenzen, die es den Studierenden erlauben, im Team serverzentriere Webanwendungen zu entwickeln, hohe Ansprüche an Reaktivität, Skalierbarkeit und Durchsatz zu erfüllen.|9|Prof. Dr. Klaus-Dieter Quibeldey-Cirkel|https://www.thm.de/organizer/?option=com_organizer&view=SubjectItem&id=608|Informatik (B.Sc. 2010)Datenbanksysteme (CS1020)Webbasierte Systeme (CS1024), Datenbanksysteme (CS1020), Webbasierte Systeme (CS1024), Social Media Systems (B.Sc. 2016)Webbasierte Programmierung 2 (IT1002), Webbasierte Programmierung 2 (IT1002)|4|FB06-MNI|Soc.MediaSys.(B.Sc.2016)
SK2025|Ethik im Management|Das Modul vermittelt die Grundlagen der allgemeinen und ökonomischen Ethik und sensibilisiert die Studierenden für ethische Fragestellungen im Managementbereich.|3|Laura Magdeburg|https://www.thm.de/organizer/?option=com_organizer&view=SubjectItem&id=1529|Keine|4|FB06-MNI|Soc.MediaSys.(B.Sc.2016)
CS2377|Evaluation Interaktiver Systeme|Das Modul behandelt das Planen, die Durchführung und die Auswertung von empirischen Studien. Basierend auf diesen Grundlagen planen die Teilnehmer eine eigene Studie, nehmen gegenseitig an den Studien anderer Kursteilnehmer teil und werten anschließend die erlangten Daten aus.|6|Prof. Dr. Martin Weigel|https://www.thm.de/organizer/?option=com_organizer&view=SubjectItem&id=2065|Keine|4|FB06-MNI|Soc.MediaSys.(B.Sc.2016)
SM2510|Forschungsfelder Medien|Das Modul vermittelt vertiefte Kenntnisse zu Forschungsfeldern, Theorien und Modellen der Medien- und Kommunikationswissenschaften. Der Fokus liegt auf den spezifischen methodischen Zugängen zu Forschungsfeldern der digitalen und sozialen Medien.|6|Prof. Dr. Julie Dolores Woletz|https://www.thm.de/organizer/?option=com_organizer&view=SubjectItem&id=1537|Keine|4|FB06-MNI|Soc.MediaSys.(B.Sc.2016)
EB2005|Geschäftsprozessmanagement|In dieser Veranstaltung wird abgeleitet von der Unternehmensstrategie der Zyklus des Geschäftsprozessmanagements (Strategie, Analyse, Entwurf, Implementierung, Kontrolle) theoretisch und praktisch vermittelt.|6|Prof. Dr. Peter Hohmann|https://www.thm.de/organizer/?option=com_organizer&view=SubjectItem&id=893|Keine|4|FB06-MNI|Soc.MediaSys.(B.Sc.2016)
SK2017|Gesellschaftliche Verantwortung in der Informatik|"Gezielte Wahlwerbung, ""scoring"", de-Akkreditierung von Journalisten wegen falscher Datenbankeinträge sowie Töten von Menschen auf Basis von Metadaten: Informatik verändert unsere Gesellschat radikal. Dieses Modul behandelt aktuelle Fragestellungen zum Verhältnis von Informatik(er) und Gesellschaft."|6|Prof. Dr. Alexander Dworschak|https://www.thm.de/organizer/?option=com_organizer&view=SubjectItem&id=791|Keine|4|FB06-MNI|Soc.MediaSys.(B.Sc.2016)
CS2364|Grundlagen der Künstlichen Intelligenz|Die Vorlesung gibt einen Überblick über wichtige Anwendungen (Chatbots, Games, Data-Mining, Bilderkennung, etc.) und Methoden der Künstlichen Intelligenz.|6|Dr. habil. Frank Kammer|https://www.thm.de/organizer/?option=com_organizer&view=SubjectItem&id=1216|Informatik (B.Sc. 2010)Algorithmen und Datenstrukturen (CS1017), Algorithmen und Datenstrukturen (CS1017)|4|FB06-MNI|Soc.MediaSys.(B.Sc.2016)
CS2352|Grundlagen der Systemtheorie|Die Veranstaltung vermittelt die Grundlagen der Systemtheorie mit Schwerpunkt auf Informationstechnologie, Naturwissenschaften und Kommunikation in sozialen Medien.|6|Prof. Dr. Axel Schumann|https://www.thm.de/organizer/?option=com_organizer&view=SubjectItem&id=890|Keine|4|FB06-MNI|Soc.MediaSys.(B.Sc.2016)
CS2355|Grundlagen des Cloud Computing|Im Rahmen dieser Veranstaltung werden grundlegende Konzepte und Methoden des Cloud Computings vermittelt.|6|Steffen Rupp|https://www.thm.de/organizer/?option=com_organizer&view=SubjectItem&id=1080|Keine|4|FB06-MNI|Soc.MediaSys.(B.Sc.2016)
SM1001|Grundlagen und Anwendungen Social Media 1|In der Lehrveranstaltung bekommen die Studierenden einen Überblick über die wichtigsten Theorien der Kommunikations- und Medienwissenschaften – mit einem starken Fokus auf digitale und soziale Medien. Innerhalb der Veranstaltung werden dabei die theoretischen und methodischen Grundlagen für die spätere Produktion digitaler Inhalte sowie wissenschaftlicher Analysen vermittelt.|10|Prof. Dr. Benjamin Gust|https://www.thm.de/organizer/?option=com_organizer&view=SubjectItem&id=800|Keine|4|FB06-MNI|Soc.MediaSys.(B.Sc.2016)
SM1002|Grundlagen und Anwendungen Social Media 2|Die Veranstaltung vermittelt zentrale Theorien der Kommunikations- und Medienforschung mit Fokus auf digitale/soziale Medien. Studierende lernen theoretische und methodische Grundlagen zur nutzerzentrierten Entwicklung digitaler Medien und wenden diese in einem praktischen Medienprojekt an.|5|Prof. Dr. Julie Dolores Woletz|https://www.thm.de/organizer/?option=com_organizer&view=SubjectItem&id=801|Social Media Systems (B.Sc. 2016)Grundlagen und Anwendungen Social Media 1 (SM1001), Grundlagen und Anwendungen Social Media 1 (SM1001)|4|FB06-MNI|Soc.MediaSys.(B.Sc.2016)
CS2378|Haptische Benutzerschnittstellen|Einführung in haptische Benutzerschnittstellen für interaktive Systeme. Basierend auf den erlernten theoretischen Grundlagen entwerfen und programmieren die Studierenden ein haptisches Ausgabegerät mithilfe von Arduino-Mikrocontrollern.|6|Prof. Dr. Martin Weigel|https://www.thm.de/organizer/?option=com_organizer&view=SubjectItem&id=2066|Keine|4|FB06-MNI|Soc.MediaSys.(B.Sc.2016)
SK2018|Improvisationstheater - Schulung der Kreativität|In der Veranstaltung wird mit Hilfe von verschiedenen Improvisationstechniken gezielt die Kreativität, situative Flexibilität und Spontaneität sowie die Sensibilität für die Umgebung, Selbstvertrauen und Schnelligkeit der Studierenden geschult.|3|Laura Magdeburg|https://www.thm.de/organizer/?option=com_organizer&view=SubjectItem&id=793|Keine|4|FB06-MNI|Soc.MediaSys.(B.Sc.2016)
II2018|Industrie 4.0 - Einführung, Konzepte und Technologien|In der Veranstaltung lernen die Studierenden die Grundlagen von Industrie 4.0 kennen und welche Zielsetzungen mit der Einführung erreicht werden sollen. Des Weiteren lernen die Studierenden die Konzepte und Technologien von Industrie 4.0 kennen|6|Prof. Dr. Christian Überall|https://www.thm.de/organizer/?option=com_organizer&view=SubjectItem&id=888|Keine|4|FB06-MNI|Soc.MediaSys.(B.Sc.2016)
EB2002|Informationsmanagement|Der Schwerpunkt dieser Veranstaltung liegt beim strategischen und operativen Management der betrieblichen IT-Systeme und deren Umfeld.|6|Prof. Dr. Peter Hohmann|https://www.thm.de/organizer/?option=com_organizer&view=SubjectItem&id=754|Keine|4|FB06-MNI|Soc.MediaSys.(B.Sc.2016)
EB2507|Innovationsmanagement|Die Studierenden lernen die Methoden, Verfahren und Prozesse des Innovationsmanagements kennen und erarbeiten sich anhand von Praxisbeispielen die einzelnen Schritte des Innovationsprozesses.|3|Prof. Dr. Armin Wagenknecht|https://www.thm.de/organizer/?option=com_organizer&view=SubjectItem&id=894|Keine|4|FB06-MNI|Soc.MediaSys.(B.Sc.2016)
GEN1000|Integrationsprojekt (Orientierungsphase)|In der Veranstaltung werden die Kenntnisse aus den Einführungsveranstaltungen der Bereiche Management, Medien und IT in einem gemeinsamen Projekt fachlich zusammengeführt. Zudem werden Grundlagen und Anwendungen des Projektmanagements vermittelt.|15|Prof. Dr. Peter KneiselProf. Dr. Armin WagenknechtProf. Dr. Julie Dolores Woletz|https://www.thm.de/organizer/?option=com_organizer&view=SubjectItem&id=805|Social Media Systems (B.Sc. 2016)BWL und Informationssysteme 1 (EB1001)Grundlagen und Anwendungen Social Media 1 (SM1001)Webbasierte Programmierung 1 (IT1001), BWL und Informationssysteme 1 (EB1001), Grundlagen und Anwendungen Social Media 1 (SM1001), Webbasierte Programmierung 1 (IT1001)|4|FB06-MNI|Soc.MediaSys.(B.Sc.2016)
GEN1003|Integrationsprojekt (Vertiefungsphase)|In der Veranstaltung werden die Kenntnisse aus den Vertiefungsveranstaltungen der Bereiche Management, Medien und IT in einem gemeinsamen Projekt fachlich zusammengeführt.|9|Prof. Dr. Peter KneiselProf. Dr. Armin WagenknechtProf. Dr. Julie Dolores Woletz|https://www.thm.de/organizer/?option=com_organizer&view=SubjectItem&id=1287|Keine|4|FB06-MNI|Soc.MediaSys.(B.Sc.2016)
CS2370|Interaktive Systeme|Der Kurs vermittelt die theoretischen und praktischen Grundlagen von Mensch-Computer-Interaktion. Er beinhaltet Modelle der menschlichen Informationsverarbeitung, Prinzipien zur Realisierung von guten Benutzerschnittstellen, benutzerorientierte Gestaltungsprozesse und die Evaluation von Benutzerschnittstellen durch empirische Studien.|6|Prof. Dr. Martin Weigel|https://www.thm.de/organizer/?option=com_organizer&view=SubjectItem&id=1714|Keine|4|FB06-MNI|Soc.MediaSys.(B.Sc.2016)
SK2031|International Buddy Programme - Intercultural Competence and Encounters|Durch aktive Teilnahme am Internationalen Buddy Programms der THM entwickeln Studierende ihre interkulturellen Kompetenzen und parallel ihre fremdsprachlichen Kenntnisse. Darüber hinaus erlernen sie in kulturell heterogenen Gruppen teamfähig zu sein.|3|Dipl.-Sprachlehrerin Christine Maria Beckmann|https://www.thm.de/organizer/?option=com_organizer&view=SubjectItem&id=2079|Keine|4|FB06-MNI|Soc.MediaSys.(B.Sc.2016)
SK2023|Konfliktmanagement und Mediation|Das Modul vermittelt Grundlagen im Konfliktmanagement. Thematisiert werden die Entstehung, Merkmale und Wirkungen von Konflikten sowie das Vermitteln und deeskalierende einwirken.|3|Laura Magdeburg|https://www.thm.de/organizer/?option=com_organizer&view=SubjectItem&id=1527|Keine|4|FB06-MNI|Soc.MediaSys.(B.Sc.2016)
CS2016|Konzepte moderner Softwareentwicklung|Der Kurs vermittelt die Grundlagen von gängigen Softwareentwicklungs-Praktiken. Dies geschieht durch selbstständig durchgeführte Teamarbeit innerhalb praxisnaher Softwareprojekte. Dabei erproben die Teilnehmenden die Einarbeitung in produktive Softwaresysteme durch bewährte Techniken.|9|Prof. Dr. Peter Kneisel|https://www.thm.de/organizer/?option=com_organizer&view=SubjectItem&id=787|Keine|4|FB06-MNI|Soc.MediaSys.(B.Sc.2016)
SK2021|Kreativitätstechniken|In der Veranstaltung erproben die Studierenden verschiedene Kreativitätstechniken, die ihnen im Rahmen von Innovations- und Gestaltungsprozessen zur Medienkonzeption und Medienproduktion neue Gestaltungsspielräume eröffnen.|3|Prof. Dr. Julie Dolores Woletz|https://www.thm.de/organizer/?option=com_organizer&view=SubjectItem&id=1212|Keine|4|FB06-MNI|Soc.MediaSys.(B.Sc.2016)
SK2032|Lerngestaltung, Prüfungsvorbereitung und Stressbewältigung im Studium|Was braucht es, damit die Informationen aus dem Studium zu Wissen in meinem Kopf werden, und ich neue Fähigkeiten entwickle? Was kann ich tun, um mein Lernen im Studium günstig zu beeinflussen, zu erleichtern? Und wie erreiche ich Prüfungsstabilität, damit ich mein Wissen im entscheidenden Moment zeigen kann?|3|Laura Magdeburg|https://www.thm.de/organizer/?option=com_organizer&view=SubjectItem&id=2092|Keine|4|FB06-MNI|Soc.MediaSys.(B.Sc.2016)
CS2356|Machine Learning|Das Modul vermittelt die Grundlagen des Machinellen Lernens. Dazu zählt ein Überblick über die mathematischen und algorithmischen Grundlagen des Fachs sowie deren Umsetzung in Python unter Verwendung gängiger Frameworks, wie Numpy, Scipy, Scikit-Learn, Keras oder Tensorflow.|6|Prof. Dr. Franz Cemic|https://www.thm.de/organizer/?option=com_organizer&view=SubjectItem&id=1217|Keine|4|FB06-MNI|Soc.MediaSys.(B.Sc.2016)
SM2900|Mediales Praktikum|In der Veranstaltung werden die Kenntnisse der Mediengestaltung und -produktion aus den verschiedenen Modulen des Vertiefungspools Medien in praktischen Projekten vertieft.|9|Prof. Dr. Julie Dolores Woletz|https://www.thm.de/organizer/?option=com_organizer&view=SubjectItem&id=788|Keine|4|FB06-MNI|Soc.MediaSys.(B.Sc.2016)
SK2007|Methoden und Didaktik für Tutorinnen und Tutoren|Die Studierenden haben Grundlagen der Didaktik und Methodik erworben und im Rahmen einer Praxisphase als Tutor/in angewendet.|3|Prof. Silke Bock|https://www.thm.de/organizer/?option=com_organizer&view=SubjectItem&id=640|Keine|4|FB06-MNI|Soc.MediaSys.(B.Sc.2016)
SK2024|Mit der richtigen Technik das Lernen lernen|Im Rahmen des Moduls wird das Thema Lernen aus verschiedenen Perspektiven betrachtet und Strategien zum erfolgreichen Lernen erarbeitet.|3|Laura Magdeburg|https://www.thm.de/organizer/?option=com_organizer&view=SubjectItem&id=1528|Keine|4|FB06-MNI|Soc.MediaSys.(B.Sc.2016)
SK2026|Moderation in Unternehmen und Organisationen|Die Studierenden erhalten einen Überblick über verschiedene Moderationstechniken und können diese effektiv einsetzen.|3|Laura Magdeburg|https://www.thm.de/organizer/?option=com_organizer&view=SubjectItem&id=1530|Keine|4|FB06-MNI|Soc.MediaSys.(B.Sc.2016)
IT2002|Objektorientierte Programmierung für Quereinsteiger|Das Modul vermittelt Programmierquereinsteigern einen vertieften Zugang zur objektorientierten Programmierung.|3|Prof. Dr. Peter Kneisel|https://www.thm.de/organizer/?option=com_organizer&view=SubjectItem&id=1608|Keine|4|FB06-MNI|Soc.MediaSys.(B.Sc.2016)
CS2020|Offensive IT-Sicherheit|Dieses Modul behandelt die Thematik der Tool-gestützten offensiven IT-Sicherheit, die sich mit der Übernahme von Computersystemen, durch das Überwinden von technischen Schutzmechanismen und das Ausnutzen von Sicherheitslücken, beschäftigt.|9|Prof. Dr. Andre Rein|https://www.thm.de/organizer/?option=com_organizer&view=SubjectItem&id=1605|Informatik (B.Sc. 2010)Einführung IT-Security: Kryptografie, Software und Systemsicherheit (CS2362), Einführung IT-Security: Kryptografie, Software und Systemsicherheit (CS2362), Social Media Systems (B.Sc. 2016)Einführung IT-Security: Kryptografie, Software und Systemsicherheit (CS2362), Einführung IT-Security: Kryptografie, Software und Systemsicherheit (CS2362)|4|FB06-MNI|Soc.MediaSys.(B.Sc.2016)
CS2021|Praktikum Game Design und Development|Diese Veranstaltung vermittelt Grundlagen zur Konzeption und Entwicklung von analogen und digitalen Spielen.|9|Prof. Dr. Peter Kneisel|https://www.thm.de/organizer/?option=com_organizer&view=SubjectItem&id=1606|Keine|4|FB06-MNI|Soc.MediaSys.(B.Sc.2016)
SM2901|Praktikum UX/Usability Labor|Die Veranstaltung vermittelt empirische Methoden zur Planung, Durchführung und Auswertung von Mediennutzungsforschung, Usability und User Experience Tests im UX/Usability Lab.|9|Prof. Dr. Julie Dolores Woletz|https://www.thm.de/organizer/?option=com_organizer&view=SubjectItem&id=792|Keine|4|FB06-MNI|Soc.MediaSys.(B.Sc.2016)
CS2015|Praktikum Wirtschaftsinformatik|Teamorientierte Entwicklung von Geschäftsanwendungen mit aktuellen Themen und Technologien.|9|Prof. Dr. Harald Ritz|https://www.thm.de/organizer/?option=com_organizer&view=SubjectItem&id=20|Keine|4|FB06-MNI|Soc.MediaSys.(B.Sc.2016)
CS2358|Projekt - Industrie  4.0 und Digitalisierung|Studierende unterschiedlicher Fachbereiche sollen ein interdisziplinäres Projekt umsetzen und ihre Fachkompetenzen anwenden, um das Projekt unter realen Bedingungen durchzuführen. Bei dem interdisziplinären Projekt übernehmen die Studierenden die Implementierung der funktionalen und nichtfunktionalen Anforderungen des Projekts.|6|Prof. Dr. Christian Überall|https://www.thm.de/organizer/?option=com_organizer&view=SubjectItem&id=1085|Keine|4|FB06-MNI|Soc.MediaSys.(B.Sc.2016)
CS2361|Projektentwicklung mit Kotlin|Das Modul liefert einen Einblick in die Programmiersprache Kotlin und vermittelt technische und methodische Grundlagen für die Entwicklung von Kotlin-Anwendungen. Die Grundlagen werden anhand eines Projektes praktisch umgesetzt.|6|Prof. Dr. Peter Kneisel|https://www.thm.de/organizer/?option=com_organizer&view=SubjectItem&id=1207|Informatik (B.Sc. 2010)Webbasierte Systeme (CS1024), Webbasierte Systeme (CS1024), Social Media Systems (B.Sc. 2016)Webbasierte Programmierung 2 (IT1002), Webbasierte Programmierung 2 (IT1002)|4|FB06-MNI|Soc.MediaSys.(B.Sc.2016)
BA2001|Projektmanagement erleben|Die Studierenden erleben Projektmanagement in einem fiktiven Unternehmen. Das Modul macht klassisches, agiles und systemisches Projektmanagement anhand eines Planspiels erlebbar.|3|Prof. Dr. Bettina Just|https://www.thm.de/organizer/?option=com_organizer&view=SubjectItem&id=1435|Keine|4|FB06-MNI|Soc.MediaSys.(B.Sc.2016)
CS3004|Projektphase|Die Studierenden arbeiten selbstbestimmt und entwickeln ein konkretes Projekt. Das Modul ist die Basis für die Bachelorarbeit.|12|Prof. Dr. Alexander Dworschak|https://www.thm.de/organizer/?option=com_organizer&view=SubjectItem&id=770|Social Media Systems (B.Sc. 2016)Projektseminar (CS3005), Projektseminar (CS3005)|4|FB06-MNI|Soc.MediaSys.(B.Sc.2016)
CS3005|Projektseminar|In diesem Seminar präsentieren die Studierenden die Ergebnisse ihrer Projektphase in einer klar strukturierten Präsentation.|3|Prof. Dr. Alexander Dworschak|https://www.thm.de/organizer/?option=com_organizer&view=SubjectItem&id=1218|Social Media Systems (B.Sc. 2016)Projektphase (CS3004), Projektphase (CS3004)|4|FB06-MNI|Soc.MediaSys.(B.Sc.2016)
SM2507|Quantified Self und Transhumanismus|In der Veranstaltung lernen die Studierenden die Themengebiete „Quantified Self” und „Transhumanismus” unter einer wissenschaftlichen Sichtweise kennen, können diese differenziert diskutieren und moralisch hinterfragen.|3|Prof. Dr. Julie Dolores Woletz|https://www.thm.de/organizer/?option=com_organizer&view=SubjectItem&id=1084|Keine|4|FB06-MNI|Soc.MediaSys.(B.Sc.2016)
SM2002|Redaktionsmanagement|Die Veranstaltung stellt die Aufgaben bei der Leitung einer Online-Redaktion dar, übt den Umgang mit den dafür einzusetzenden Methoden und trainiert die Studierenden bei der Kommunikation mit Dienstleistern, Kunden und Anwendern.|6|Benedikt Ansgar Model|https://www.thm.de/organizer/?option=com_organizer&view=SubjectItem&id=786|Keine|4|FB06-MNI|Soc.MediaSys.(B.Sc.2016)
CS2360|Requirements Engineering|Eine Anforderungsanalyse entscheidet über den Erfolg eines Projektes oder Produktes. Sie nimmt eine zentrale Stellung in der Systementwicklung ein. Das Modul „Requirements Engineering” behandelt den Prozess, Anforderungen an Systeme zu erheben und ihre ständige Veränderung zu managen. Es vermittelt Strategien zur pragmatischen Umsetzung.|6|Prof. Dr. Harald Ritz|https://www.thm.de/organizer/?option=com_organizer&view=SubjectItem&id=1209|Keine|4|FB06-MNI|Soc.MediaSys.(B.Sc.2016)
SK2019|Rhetorik und Körpersprache|Die Studierenden lernen die Grundlagen der Kommunikationspsychologie kennen. Einfache Redetechniken, körpersprachliche Präsentation und kreatives Denken werden in vielen Übungen erarbeitet.|3|Laura Magdeburg|https://www.thm.de/organizer/?option=com_organizer&view=SubjectItem&id=896|Keine|4|FB06-MNI|Soc.MediaSys.(B.Sc.2016)
SM2508|Ringvorlesung Medien|Das Modul vermittelt vertiefte Kenntnisse zu Themenfeldern, Theorien und Modellen der Medienwissenschaften. Der Fokus liegt auf spezifischen Positionen und Forschungsansätzen zu digitalen und sozialen Medien auch aus angrenzenden Disziplinen wie z.B. der Bild- und Filmwissenschaften und Game Studies.|6|Prof. Dr. Julie Dolores Woletz|https://www.thm.de/organizer/?option=com_organizer&view=SubjectItem&id=1210|Keine|4|FB06-MNI|Soc.MediaSys.(B.Sc.2016)
CS2320|Ruby on Rails|Ruby On Rails ist eine Einführung in die objektorientierte Programmiersprache Ruby und das Framework Ruby on Rails.|6|Prof. Dr. Alexander Dworschak|https://www.thm.de/organizer/?option=com_organizer&view=SubjectItem&id=32|Keine|4|FB06-MNI|Soc.MediaSys.(B.Sc.2016)
CS2330|SAP R/3 - Einführung in ABAP|Reportprogrammierung in SAP/R3 mit ABAP.|6|Prof. Dr. Peter Hohmann|https://www.thm.de/organizer/?option=com_organizer&view=SubjectItem&id=34|Keine|4|FB06-MNI|Soc.MediaSys.(B.Sc.2016)
CS2348|Secure Software Engineering|Sicheres Deployment, Analysewerkzeuge, typische Sicherheitslücken und Verschlüsselungssysteme|6|Dr. habil. Frank Kammer|https://www.thm.de/organizer/?option=com_organizer&view=SubjectItem&id=895|Informatik (B.Sc. 2010)Datenbanksysteme (CS1020)Webbasierte Systeme (CS1024), Datenbanksysteme (CS1020), Webbasierte Systeme (CS1024), Social Media Systems (B.Sc. 2016)Webbasierte Programmierung 2 (IT1002), Webbasierte Programmierung 2 (IT1002)|4|FB06-MNI|Soc.MediaSys.(B.Sc.2016)
CS2376|Sicherheit und Datenschutz in der Webentwicklung|Um Websites und -server vor Hackerangriffen zu schützen, werden Verfahren vermittelt, um den Besucherverkehr zu überwachen, datenschutzkonform auszuwerten und Angriffe zu erkennen sowie Schutzmaßnahmen zu implementieren und den verantwortungsvollen Umgang mit personenbezogenen Daten zu praktizieren.|6|Prof. Dr. Andre Rein|https://www.thm.de/organizer/?option=com_organizer&view=SubjectItem&id=2063|Keine|4|FB06-MNI|Soc.MediaSys.(B.Sc.2016)
EB2004|Social Collaboration Management|Der Schwerpunkt dieser Veranstaltung liegt in der Theorie, Auswahl, Einführung, Anpassung und Nutzung sozialer Kollaborationsplattformen in und zwischen Betrieben.|6|Prof. Dr. Armin Wagenknecht|https://www.thm.de/organizer/?option=com_organizer&view=SubjectItem&id=756|Keine|4|FB06-MNI|Soc.MediaSys.(B.Sc.2016)
SM2504|Social Media für öffentliche Einrichtungen|In der Veranstaltung lernen die Studierenden, wie Social Media für öffentliche Einrichtungen eingesetzt werden kann und welche speziellen Zielsetzungen, Strategien und Erfolgsmaßstäbe für non-profit Social Media Aktivitäten relevant sind.|3|Prof. Dr. Julie Dolores Woletz|https://www.thm.de/organizer/?option=com_organizer&view=SubjectItem&id=887|Keine|4|FB06-MNI|Soc.MediaSys.(B.Sc.2016)
SM2005|Social Media im unternehmensinternen Einsatz|Die Veranstaltung erklärt die Grundzüge interner Unternehmenskommunikation und ordnet den Einsatz von Social Media für diesen Kommunikationszweck ein.|6|Prof. Dr. Julie Dolores Woletz|https://www.thm.de/organizer/?option=com_organizer&view=SubjectItem&id=810|Keine|4|FB06-MNI|Soc.MediaSys.(B.Sc.2016)
SM2004|Social Media in der Unternehmensstrategie|In der Veranstaltung lernen die Studierenden, wie Social Media strategisch in der Unternehmenskommunikation eingesetzt werden kann. Sie konzipieren, planen und realisieren eine eigene Social Media Strategie.|6|Prof. Dr. Julie Dolores Woletz|https://www.thm.de/organizer/?option=com_organizer&view=SubjectItem&id=769|Keine|4|FB06-MNI|Soc.MediaSys.(B.Sc.2016)
CS2365|Swift-Programmierung unter iOS|Dieses Modul vermittelt Grundlagen und Techniken der Anwendungsentwicklung mit Swift.|6|Prof. Dr. Peter Kneisel|https://www.thm.de/organizer/?option=com_organizer&view=SubjectItem&id=1245|Informatik (B.Sc. 2010)Programmierung interaktiver Systeme (CS1016), Programmierung interaktiver Systeme (CS1016), Social Media Systems (B.Sc. 2016)Webbasierte Programmierung 2 (IT1002), Webbasierte Programmierung 2 (IT1002)|4|FB06-MNI|Soc.MediaSys.(B.Sc.2016)
